{
  "$schema": "https://json-schema.org/draft/2020-12/schema",
  "type": "object",
  "properties": {
    "team_id": {
      "type": "string"
    },
    "full_name": {
      "type": "string"
    },
    "division": {
      "type": [
        "string",
        "null"
      ]
    },
    "tz": {
      "type": [
        "string",
        "null"
      ]
    }
  },
  "required": [
    "team_id",
    "full_name"
  ],
  "additionalProperties": false
}
