[{"team_id":"ARI","full_name":"Arizona Cardinals","division":"NFC West","tz":"America/Phoenix"},{"team_id":"ATL","full_name":"Atlanta Falcons","division":"NFC South","tz":"America/New_York"},{"team_id":"BAL","full_name":"Baltimore Ravens","division":"AFC North","tz":"America/New_York"},{"team_id":"BUF","full_name":"Buffalo Bills","division":"AFC East","tz":"America/New_York"},{"team_id":"CAR","full_name":"Carolina Panthers","division":"NFC South","tz":"America/New_York"},{"team_id":"CHI","full_name":"Chicago Bears","division":"NFC North","tz":"America/Chicago"},{"team_id":"CIN","full_name":"Cincinnati Bengals","division":"AFC North","tz":"America/New_York"},{"team_id":"CLE","full_name":"Cleveland Browns","division":"AFC North","tz":"America/New_York"},{"team_id":"DAL","full_name":"Dallas Cowboys","division":"NFC East","tz":"America/Chicago"},{"team_id":"DEN","full_name":"Denver Broncos","division":"AFC West","tz":"America/Denver"},{"team_id":"DET","full_name":"Detroit Lions","division":"NFC North","tz":"America/Detroit"},{"team_id":"GB","full_name":"Green Bay Packers","division":"NFC North","tz":"America/Chicago"},{"team_id":"HOU","full_name":"Houston Texans","division":"AFC South","tz":"America/Chicago"},{"team_id":"IND","full_name":"Indianapolis Colts","division":"AFC South","tz":"America/Indiana/Indianapolis"},{"team_id":"JAX","full_name":"Jacksonville Jaguars","division":"AFC South","tz":"America/New_York"},{"team_id":"KC","full_name":"Kansas City Chiefs","division":"AFC West","tz":"America/Chicago"},{"team_id":"LA","full_name":"Los Angeles Rams","division":"NFC West","tz":"America/Los_Angeles"},{"team_id":"LAC","full_name":"Los Angeles Chargers","division":"AFC West","tz":"America/Los_Angeles"},{"team_id":"LV","full_name":"Las Vegas Raiders","division":"AFC West","tz":"America/Los_Angeles"},{"team_id":"MIA","full_name":"Miami Dolphins","division":"AFC East","tz":"America/New_York"},{"team_id":"MIN","full_name":"Minnesota Vikings","division":"NFC North","tz":"America/Chicago"},{"team_id":"NE","full_name":"New England Patriots","division":"AFC East","tz":"America/New_York"},{"team_id":"NO","full_name":"New Orleans Saints","division":"NFC South","tz":"America/Chicago"},{"team_id":"NYG","full_name":"New York Giants","division":"NFC East","tz":"America/New_York"},{"team_id":"NYJ","full_name":"New York Jets","division":"AFC East","tz":"America/New_York"},{"team_id":"PHI","full_name":"Philadelphia Eagles","division":"NFC East","tz":"America/New_York"},{"team_id":"PIT","full_name":"Pittsburgh Steelers","division":"AFC North","tz":"America/New_York"},{"team_id":"SEA","full_name":"Seattle Seahawks","division":"NFC West","tz":"America/Los_Angeles"},{"team_id":"SF","full_name":"San Francisco 49ers","division":"NFC West","tz":"America/Los_Angeles"},{"team_id":"TB","full_name":"Tampa Bay Buccaneers","division":"NFC South","tz":"America/New_York"},{"team_id":"TEN","full_name":"Tennessee Titans","division":"AFC South","tz":"America/Chicago"},{"team_id":"WAS","full_name":"Washington Commanders","division":"NFC East","tz":"America/New_York"}]
